<?xml version="1.0" encoding="UTF-8"?>
<!DOCTYPE root SYSTEM "Menu.dtd" >
<!-- ftm.xml -->

<root xmlns:xi="http://www.w3.org/2001/XInclude">
   <menu name="_instance" description="Flex timer">
      <choiceOption name="MODE" description="Mode"
         toolTip="Communication mode">
         <choice value="0" name="Mode 0: CPOL=0, CPHA=0" />
         <choice value="1" name="Mode 1: CPOL=0, CPHA=1" />
         <choice value="2" name="Mode 2: CPOL=1, CPHA=0" />
         <choice value="3" name="Mode 3: CPOL=1, CPHA=1" />
         <choice value="1" name="Default" />
      </choiceOption>

      <intOption name="SPEED" description="Speed"
         toolTip="Speed of transmission"
         value="0" min="0" max="10000000" />

      <binaryOption name="LSBFE" description="Handler for IRQ"
         toolTip="Transmission order">
         <choice value="0" name="MSB first" />
         <choice value="1" name="LSB first" />
      </binaryOption>

      <binaryOption name="IRQ_HANDLER" description="Handler for IRQ"
         toolTip="Polling or interrupts may be used to update the state machine">
         <choice value="0" name="Use polling" />
         <choice value="1" name="Use interrupts" />
      </binaryOption>

      <intOption name="IRQ_LEVEL" description="IRQ Level in NVIC [0-15]"
         toolTip="Sets the priority level used to configure the NVIC"
         value="0" min="0" max="15" />
   </menu>
   <template>
      #ifdef SPI_CTAR_LSBFE_SHIFT\n
      \t//! Default communication mode: order, clock phase and clock polarity\n
      \tstatic constexpr uint32_t modeValue = ($(LSBFE)&lt;&lt;SPI_CTAR_LSBFE_SHIFT)|($(MODE)&lt;&lt;SPI_CTAR_CPHA_SHIFT);\n\n
      #endif\n
      \t//! Default speed (Hz)\n
      \tstatic constexpr uint32_t speed = $(SPEED);\n\n
       \t//! Default IRQ level\n
       \tstatic constexpr uint32_t irqLevel =  $(IRQ_LEVEL);\n\n
   </template>
</root>
